{
  "metadata": {
    "version": "1.0.0",
    "generated_at": "2026-07-06T22:03:52.970876+00:00",
    "year_range": [
      2018,
      2025
    ],
    "n_total": 179,
    "n_clustered": 177,
    "act_disclaimer_es": "PROVISIONAL: Tipología basada en dimension_delito (DS2 estandarizado por taxonomía dinámica).",
    "source_files": {
      "tabla_clustering_final": "data/master/tabla_clustering_final.parquet",
      "master_table": "data/master/master_table.parquet",
      "sexuales_limpio": "data/cleaned/sexuales_limpio.parquet"
    }
  },
  "sub_acto_3_1": {
    "title_es": "",
    "anchor_text_es": "La violencia intrafamiliar es de mujeres adultas. La violencia sexual es de niñas — y la mitad es abuso a menores de 14 años. La infancia es el escenario más frecuente.",
    "stat_cards": [
      {
        "id": "pct_under_14",
        "label_es": "Víctimas menores de 14 años",
        "display_format": "percent_1d",
        "badge": null,
        "sub_value": null,
        "value": 50.61
      },
      {
        "id": "pct_all_minors",
        "label_es": "Víctimas menores de 18 años",
        "display_format": "percent_1d",
        "badge": null,
        "sub_value": null,
        "value": 54.29
      },
      {
        "id": "total_cases",
        "label_es": "Total casos peritados",
        "display_format": "integer_thousands",
        "badge": null,
        "sub_value": {
          "value": null,
          "label_es": "Registros policiales DS2 — universo distinto al forense (Acto 4)"
        },
        "value": 29594
      }
    ]
  },
  "sub_acto_3_2": {
    "title_es": "El contraste de tasas de violencia intrafamiliar y violencia sexual",
    "anchor_text_es": "El gráfico contrasta los dos tipos de violencia por municipio en el periodo 2018–2025",
    "data": {
      "n_points": 177,
      "aggregation_method": "per_municipality_averages_tabla_clustering_final",
      "axes": {
        "x": "vif_f_total_rate = tasa_vif_nna_f + tasa_vif_adultas_f (por 100k femenino)",
        "y": "sexual_f_total_rate = tasa_sexual_nna_f + tasa_sexual_adultas_f (por 100k femenino)"
      },
      "reference_lines": {
        "x_median": 191.66,
        "y_median": 155.36
      },
      "quadrants": {
        "coexistencia_alta": {
          "label": "Coexistencia alta",
          "n": 71,
          "tooltip": "Alta VIF y alta violencia sexual. Municipio con doble carga de violencia de género."
        },
        "predomina_vif": {
          "label": "Predomina VIF",
          "n": 17,
          "tooltip": "Alta violencia intrafamiliar, baja violencia sexual. El hogar es el escenario predominante."
        },
        "predomina_sexual": {
          "label": "Predomina Sexual",
          "n": 17,
          "tooltip": "Alta violencia sexual, baja VIF. El espacio comunitario concentra el riesgo."
        },
        "bajo_perfil": {
          "label": "Bajo perfil declarado",
          "n": 72,
          "tooltip": "Baja VIF y baja violencia sexual en registros. Puede reflejar subregistro estructural, no ausencia real de violencia.",
          "disclaimer": "Baja VIF y baja violencia sexual en registros puede reflejar subregistro estructural, no ausencia real de violencia."
        }
      },
      "archetypes": [
        {
          "cod_municipio": "19142",
          "municipality": "CALOTO",
          "department": "CAUCA",
          "vif_f_total_rate": 453.43,
          "sexual_f_total_rate": 143.22,
          "quadrant": "predomina_vif",
          "is_archetype": true,
          "rank_vif": 15,
          "rank_sexual": 99,
          "cluster_id": 1,
          "cluster_name": "🔴 Alta severidad"
        },
        {
          "cod_municipio": "52540",
          "municipality": "POLICARPA",
          "department": "NARIÑO",
          "vif_f_total_rate": 331.44,
          "sexual_f_total_rate": 370.18,
          "quadrant": "coexistencia_alta",
          "is_archetype": true,
          "rank_vif": 41,
          "rank_sexual": 1,
          "cluster_id": 1,
          "cluster_name": "🔴 Alta severidad"
        },
        {
          "cod_municipio": "19050",
          "municipality": "ARGELIA",
          "department": "CAUCA",
          "vif_f_total_rate": 128.53,
          "sexual_f_total_rate": 227.56,
          "quadrant": "predomina_sexual",
          "is_archetype": true,
          "rank_vif": 127,
          "rank_sexual": 26,
          "cluster_id": 1,
          "cluster_name": "🔴 Alta severidad"
        }
      ],
      "points": [
        {
          "cod_municipio": "52001",
          "municipality": "PASTO",
          "department": "NARIÑO",
          "vif_f_total_rate": 1031.63,
          "sexual_f_total_rate": 321.2,
          "quadrant": "coexistencia_alta",
          "is_archetype": false,
          "rank_vif": 1,
          "rank_sexual": 5,
          "cluster_id": 1,
          "cluster_name": "🔴 Alta severidad"
        },
        {
          "cod_municipio": "19001",
          "municipality": "POPAYAN",
          "department": "CAUCA",
          "vif_f_total_rate": 878.23,
          "sexual_f_total_rate": 306.88,
          "quadrant": "coexistencia_alta",
          "is_archetype": false,
          "rank_vif": 2,
          "rank_sexual": 9,
          "cluster_id": 1,
          "cluster_name": "🔴 Alta severidad"
        },
        {
          "cod_municipio": "76892",
          "municipality": "YUMBO",
          "department": "VALLE DEL CAUCA",
          "vif_f_total_rate": 611.66,
          "sexual_f_total_rate": 298.72,
          "quadrant": "coexistencia_alta",
          "is_archetype": false,
          "rank_vif": 3,
          "rank_sexual": 11,
          "cluster_id": 1,
          "cluster_name": "🔴 Alta severidad"
        },
        {
          "cod_municipio": "76130",
          "municipality": "CANDELARIA",
          "department": "VALLE DEL CAUCA",
          "vif_f_total_rate": 576.66,
          "sexual_f_total_rate": 239.31,
          "quadrant": "coexistencia_alta",
          "is_archetype": false,
          "rank_vif": 4,
          "rank_sexual": 22,
          "cluster_id": 1,
          "cluster_name": "🔴 Alta severidad"
        },
        {
          "cod_municipio": "19573",
          "municipality": "PUERTO TEJADA",
          "department": "CAUCA",
          "vif_f_total_rate": 563.56,
          "sexual_f_total_rate": 212.39,
          "quadrant": "coexistencia_alta",
          "is_archetype": false,
          "rank_vif": 5,
          "rank_sexual": 42,
          "cluster_id": 1,
          "cluster_name": "🔴 Alta severidad"
        },
        {
          "cod_municipio": "76895",
          "municipality": "ZARZAL",
          "department": "VALLE DEL CAUCA",
          "vif_f_total_rate": 548.95,
          "sexual_f_total_rate": 169.32,
          "quadrant": "coexistencia_alta",
          "is_archetype": false,
          "rank_vif": 6,
          "rank_sexual": 75,
          "cluster_id": 1,
          "cluster_name": "🔴 Alta severidad"
        },
        {
          "cod_municipio": "76001",
          "municipality": "CALI",
          "department": "VALLE DEL CAUCA",
          "vif_f_total_rate": 525.11,
          "sexual_f_total_rate": 217.96,
          "quadrant": "coexistencia_alta",
          "is_archetype": false,
          "rank_vif": 7,
          "rank_sexual": 37,
          "cluster_id": 1,
          "cluster_name": "🔴 Alta severidad"
        },
        {
          "cod_municipio": "19548",
          "municipality": "PIENDAMO  TUNIA",
          "department": "CAUCA",
          "vif_f_total_rate": 517.37,
          "sexual_f_total_rate": 276.38,
          "quadrant": "coexistencia_alta",
          "is_archetype": false,
          "rank_vif": 8,
          "rank_sexual": 15,
          "cluster_id": 1,
          "cluster_name": "🔴 Alta severidad"
        },
        {
          "cod_municipio": "76670",
          "municipality": "SAN PEDRO",
          "department": "VALLE DEL CAUCA",
          "vif_f_total_rate": 499.69,
          "sexual_f_total_rate": 217.48,
          "quadrant": "coexistencia_alta",
          "is_archetype": false,
          "rank_vif": 9,
          "rank_sexual": 38,
          "cluster_id": 1,
          "cluster_name": "🔴 Alta severidad"
        },
        {
          "cod_municipio": "76111",
          "municipality": "GUADALAJARA DE BUGA",
          "department": "VALLE DEL CAUCA",
          "vif_f_total_rate": 495.35,
          "sexual_f_total_rate": 222.29,
          "quadrant": "coexistencia_alta",
          "is_archetype": false,
          "rank_vif": 10,
          "rank_sexual": 30,
          "cluster_id": 1,
          "cluster_name": "🔴 Alta severidad"
        },
        {
          "cod_municipio": "76318",
          "municipality": "GUACARI",
          "department": "VALLE DEL CAUCA",
          "vif_f_total_rate": 478.92,
          "sexual_f_total_rate": 232.73,
          "quadrant": "coexistencia_alta",
          "is_archetype": false,
          "rank_vif": 11,
          "rank_sexual": 25,
          "cluster_id": 1,
          "cluster_name": "🔴 Alta severidad"
        },
        {
          "cod_municipio": "76606",
          "municipality": "RESTREPO",
          "department": "VALLE DEL CAUCA",
          "vif_f_total_rate": 475.36,
          "sexual_f_total_rate": 339.37,
          "quadrant": "coexistencia_alta",
          "is_archetype": false,
          "rank_vif": 12,
          "rank_sexual": 3,
          "cluster_id": 1,
          "cluster_name": "🔴 Alta severidad"
        },
        {
          "cod_municipio": "76890",
          "municipality": "YOTOCO",
          "department": "VALLE DEL CAUCA",
          "vif_f_total_rate": 465.96,
          "sexual_f_total_rate": 226.57,
          "quadrant": "coexistencia_alta",
          "is_archetype": false,
          "rank_vif": 13,
          "rank_sexual": 27,
          "cluster_id": 1,
          "cluster_name": "🔴 Alta severidad"
        },
        {
          "cod_municipio": "19807",